<?xml version="1.0" encoding="UTF-8"?>
<!DOCTYPE habitantes SYSTEM "ayuntamiento.dtd">
<habitantes ayuntamiento="Isla Cristina">
   <persona id="p01">
      <nombre>José Manuel</nombre>
      <apellidos>Pérez Bermúdez</apellidos>
      <direccion>
         <via tipo="avenida">España</via>
         <numero>100</numero>
         <piso>1</piso>
         <letra>A</letra>
      </direccion>
      <tlfo>959010203</tlfo>
      <origen>Lepe</origen>
      <padre>Manuel</padre>
      <madre>María</madre>
   </persona>
   <persona id="p02">
      <nombre>María</nombre>
      <apellidos>González Faneca</apellidos>
      <direccion>
         <via tipo="avenida">España</via>
         <numero>100</numero>
         <piso>1</piso>
         <letra>A</letra>
      </direccion>
      <tlfo>959010203</tlfo>
      <origen>Isla Cristina</origen>
      <padre>José</padre>
      <madre>Cristina</madre>
   </persona>
   <persona id="p03" madre="p02" padre="p01">
      <nombre>Manuel</nombre>
      <apellidos>Pérez González</apellidos>
      <direccion>
         <via tipo="avenida">España</via>
         <numero>100</numero>
         <piso>1</piso>
         <letra>A</letra>
      </direccion>
      <tlfo>959010203</tlfo>
      <origen>Isla Cristina</origen>
   </persona>

   <!-- Más personas -->
</habitantes>
